"rowID","Q1","Q2","Q3","Q4","Q5","Q6","columnNames"
1,"Ik voel pijn","Ik voel me blij","Ik voel me verdrietig","Ik voel pijn","Ik voel me blij","Ik voel me verdrietig","helemaal niet"
2,"Ik moet er om lachen","Ik heb er de pest in","Ik moet er om lachen","Ik moet er om lachen","Ik heb er de pest in","Ik moet er om lachen","een beetje"
3,"Ik raak van slag","Ik raak van slag","Ik raak van slag","Ik raak van slag","Ik raak van slag","Ik raak van slag","redelijk goed"
4,"Ik vind het naar voor haar","Ik vind het fijn voor haar","Ik vind het naar voor haar","Ik vind het naar voor hem","Ik vind het fijn voor hemr","Ik vind het naar voor hem","sterk"
5,"Ik wil haar helpen","Ik wil haar feliciteren","Ik wil haar troosten","Ik wil haar helpen","Ik wil haar feliciteren","Ik wil haar troosten","heel sterk"
