Vnum,Vignette_title,Vignette_desc,Img
0,"","","www/intro.jpg"
1,"Onderuit met de fiets","Stel, je loopt op straat. Het is winter en glad. In de verte zie je iemand uitglijden met de fiets. Als je dichterbij komt zie je dat het een goede vriendin van je is die op de grond ligt met een nare schaafwond. Zij houdt zich groot, maar heeft veel pijn. Wat voel je en wat doe je?","www/V1_V4_pain.jpg"
2,"Een winnend lot","Je bent op een schoolfeest. Op een gegeven moment worden er een paar mooie prijzen verloot. Je valt zelf niet in de prijzen, maar wel een goede vriendin waarmee je samen op het feest bent. Zij is natuurlijk heel blij. Wat voel je en wat doe je?","www/V2_V5_happy.jpg"
3,"Gezakt voor het examen","Op school hebben jullie een belangrijk examen gehad. De uitslag wordt bekend gemaakt. Zelf ben je geslaagd, maar je beste vriendin is gezakt en moet het jaar overdoen. Je ziet haar vechten tegen de tranen. Wat voel jij en wat doe je?","www/V3_V6_sad.jpg"
4,"Plat op het water","Je bent met een paar vrienden en vriendinnen in het zwembad. Het is druk en er staat een lange rij voor de hoge duikplank. De één durft meer dan de ander en als een vriend van je treuzelt wordt hij van de plank geduwd. Hij valt plat op het water. Je ziet het gebeuren. Wat voel je en wat doe je?","www/V1_V4_pain.jpg"
5,"Succes op een talentenjacht","Een goede vriend houdt erg van zingen en optreden. Hij heeft meegedaan aan de voorrondes van de talentenjacht. Als je op school komt staat iedereen om hem heen: hij is door de voorrondes gekomen en zal op tv komen. Hij is natuurlijk heel blij. Wat voel je en wat doe je?","www/V2_V5_happy.jpg"
6,"Pesterij op straat","Stel, je loopt op straat en ziet opeens dat een vriend van je wordt gepest door een paar leeftijdsgenoten. Ze staan om hem heen, pakken zijn schooltas af en gooien de inhoud op straat. Ze lopen lachend weg. Jouw vriend pakt zijn spullen op en ziet er heel verdrietig uit. Wat voel jij en wat doe je?","www/V3_V6_sad.jpg"
